score,metric,date,value,year,sentence,number
0.788164496421814,marketable securities,"the year ended december 31, 2020",$27.3 million,2020,"for the year ended december 31, 2020, investing activities provided $146.5 million in cash primarily due to net proceeds from the mycase transaction of $191.4 million and the proceeds from maturities and sales of investment securities of $27.3 million and $16.7 million, respectively",27300000.0
0.7703438401222229,marketable securities,"december 31, 2020",$35.0 million,2020,"at december 31, 2020, we had cash and cash equivalents of $140.3 million consisting of bank deposits, money market funds, and treasury securities, and $35.0 million of investment securities consisting of united states government agency securities and treasury securities",35000000.0
0.7246650457382202,marketable securities,"the year ended december 31, 2019",$25.2 million,2019,"for the year ended december 31, 2019, investing activities used $89.9 million in cash primarily due to $54.0 million used to acquire dynasty, as well as purchases of investment securities of $25.2 million, capitalized software development costs of $21.0 million for the continued investment in our software development, and capital expenditures of $8.1 million to purchase property, equipment and intangible assets for the continued growth and expansion of our business",25200000.0
0.4596953690052032,r&d value,"december 31, 2020",$4.1 million,2020,"at december 31, 2020, we also had federal and state research and development credit carryforwards of $4.1 million and $11.5 million, respectively",4099999.9999999995
0.4596953690052032,r&d value,"december 31, 2020",$4.1 million,2020,"at december 31, 2020, we also had federal and state research and development credit carryforwards of $4.1 million and $11.5 million, respectively",4099999.9999999995
0.4315020442008972,marketable securities,"december 31, 2020",$175.3 million,2020,"at december 31, 2020, our cash and cash equivalents and investment securities had an aggregate balance of $175.3 million",175300000.0
0.419924646615982,r&d value,2019,$34.0 million,2019,"research and product development expense related to our software and solutions offered to the real estate vertical for the years ended december 31, 2020 and 2019 was $43.8 million and $34.0 million, respectively, an increase of $9.8 million, or 29%",34000000.0
0.2994954586029053,r&d value,"the years ended december 31, 2020 and",$43.8 million,2020,"research and product development expense related to our software and solutions offered to the real estate vertical for the years ended december 31, 2020 and 2019 was $43.8 million and $34.0 million, respectively, an increase of $9.8 million, or 29%",43800000.0
0.2335432022809982,retention rate,"september 30, 2020",$2.2 million,2020,"on september 30, 2020, we completed the mycase transaction for $193.0 million, consisting of $192.2 million of cash proceeds, plus a $2.2 million employee retention bonus pool funded by us, less cash divested of $0.8 million and a preliminary working capital adjustment of $0.6 million",2200000.0
